'id','livro','titulo','capitulo','secao','subsecao','artigo','sub_artigo','paragrafo','inciso','alinea','texto'
1,1,1,1,0,0,1,0,0,0,0,"Art.1oAjurisdição civil, contenciosa e voluntária, é exercida pelos juízes, em todo oterritório nacional, conforme as disposições que este Código estabelece."
2,1,1,1,0,0,2,0,0,0,0,"Art.2oNenhum juiz prestará a tutela jurisdicionalsenão quando a parte ou o interessado a requerer, nos casos e forma legais."
3,1,1,2,0,0,3,0,0,0,0,Art.3oParapropor ou contestar ação é necessário ter interesse e legitimidade.
4,1,1,2,0,0,4,0,0,0,0,Art.4oO interesse do autor pode limitar-se àdeclaração:
5,1,1,2,0,0,4,0,0,1,0,I-da existência ou da inexistência de relação jurídica;
6,1,1,2,0,0,4,0,0,2,0,II-da autenticidade ou falsidade de documento.
7,1,1,2,0,0,4,0,1,0,0,"Parágrafo único.É admissível a ação declaratória, ainda que tenhaocorrido a violação do direito."
8,1,1,2,0,0,5,0,0,0,0,"Art.5oSe, no cursodo processo, se tornar litigiosa relação jurídica de cuja existência ou inexistênciadepender o julgamento da lide, qualquer das partes poderá requerer que o juiz a declarepor sentença. (Redação dada pela Lei nº 5.925, de1973)"
9,1,1,2,0,0,6,0,0,0,0,"Art.6oNinguém poderá pleitear, em nome próprio,direito alheio, salvo quando autorizado por lei."
10,1,2,1,0,0,7,0,0,0,0,Art.7oTodapessoa que se acha no exercício dos seus direitos tem capacidade para estar em juízo.
11,1,2,1,0,0,8,0,0,0,0,"Art.8oOs incapazes serão representados ou assistidospor seus pais, tutores ou curadores, na forma da lei civil."
12,1,2,1,0,0,9,0,0,0,0,Art.9oO juiz dará curador especial:
13,1,2,1,0,0,9,0,0,1,0,"I-ao incapaz, se não tiver representante legal, ou se os interesses destecolidirem com os daquele;"
14,1,2,1,0,0,9,0,0,2,0,"II-ao réu preso, bem como ao revel citado por edital ou com hora certa."
15,1,2,1,0,0,9,0,1,0,0,"Parágrafo único.Nas comarcas onde houver representante judicial de incapazesou de ausentes, a este competirá a função de curador especial."
16,1,2,1,0,0,10,0,0,0,0,"Art.10.O cônjugesomente necessitará do consentimento do outro para propor ações que versem sobredireitos reais imobiliários. (Redação dada pela Lei nº8.952, de 1994)"
17,1,2,1,0,0,10,0,1,0,0,"§1oAmbos os cônjuges serão necessariamente citados para asações: (Renumerado do Parágrafo único pela Lei nº 8.952, de1994)"
18,1,2,1,0,0,10,0,2,0,0,"Parágrafo único pela Lei nº 8.952, de1994)"
19,1,2,1,0,0,10,0,2,1,0,"I-que versem sobre direitos reais imobiliários; (Redaçãodada pela Lei nº 8.952, de 1994)"
20,1,2,1,0,0,10,0,2,2,0,"II-resultantes de fatos que digam respeito a ambos os cônjuges ou de atospraticados por eles; (Redação dada pela Lei nº5.925, de 1973)"
21,1,2,1,0,0,10,0,2,3,0,"III-fundadas em dívidas contraídas pelo marido a bem da família, mas cujaexecução tenha de recair sobre o produto do trabalho da mulher ou os seus bensreservados; (Redação dada pela Lei nº 5.925, de1973)"
22,1,2,1,0,0,10,0,2,4,0,"IV-que tenham por objeto o reconhecimento, a constituição ou a extinção deônus sobre imóveis de um ou de ambos os cônjuges.(Redaçãodada pela Lei nº 5.925, de 1973)"
23,1,2,1,0,0,10,0,3,0,0,">§2oNasações possessórias, a participação do cônjuge do autor ou do réu somente éindispensável nos casos de composse ou de ato por ambos praticados. (Incluído pela Lei nº 8.952, de 1994)"
24,1,2,1,0,0,11,0,0,0,0,"Art.11.A autorização do marido e a outorga da mulher podem suprir-sejudicialmente, quando um cônjuge a recuse ao outro sem justo motivo, ou lhe sejaimpossível dá-la."
25,1,2,1,0,0,11,0,1,0,0,"Parágrafo único.A falta, não suprida pelo juiz, da autorização ou daoutorga, quando necessária, invalida o processo."
26,1,2,1,0,0,12,0,0,0,0,"Art.12.Serão representados em juízo, ativa e passivamente:"
27,1,2,1,0,0,12,0,0,1,0,"I-a União, os Estados, o Distrito Federal e os Territórios, por seusprocuradores;"
28,1,2,1,0,0,12,0,0,2,0,"II-o Município, por seu Prefeito ou procurador;"
29,1,2,1,0,0,12,0,0,3,0,"III-a massa falida, pelo síndico;"
30,1,2,1,0,0,12,0,0,4,0,"IV-a herança jacente ou vacante, por seu curador;"
31,1,2,1,0,0,12,0,0,5,0,"V-o espólio, pelo inventariante;"
32,1,2,1,0,0,12,0,0,6,0,"VI-as pessoas jurídicas, por quem os respectivos estatutos designarem, ou,não os designando, por seus diretores;"
33,1,2,1,0,0,12,0,0,7,0,"VII-as sociedades sem personalidade jurídica, pela pessoa a quem couber aadministração dos seus bens;"
34,1,2,1,0,0,12,0,0,8,0,"VIII-a pessoa jurídica estrangeira, pelo gerente, representante ouadministrador de sua filial, agência ou sucursal aberta ou instalada no Brasil (art. 88,parágrafo único);"
35,1,2,1,0,0,12,0,0,9,0,"IX-o condomínio, pelo administrador ou pelo síndico."
36,1,2,1,0,0,12,0,1,0,0,"§1oQuando o inventariante for dativo, todos osherdeiros e sucessores do falecido serão autores ou réus nas ações em que o espóliofor parte."
37,1,2,1,0,0,12,0,2,0,0,"§2o-As sociedades sem personalidade jurídica, quandodemandadas, não poderão opor a irregularidade de sua constituição."
38,1,2,1,0,0,12,0,3,0,0,"§3oO gerente da filial ou agência presume-seautorizado, pela pessoa jurídica estrangeira, a receber citação inicial para o processode conhecimento, de execução, cautelar e especial."
39,1,2,1,0,0,13,0,0,0,0,"Art.13.Verificando a incapacidade processual ou a irregularidade darepresentação das partes, o juiz, suspendendo o processo, marcará prazo razoável paraser sanado o defeito."
40,1,2,1,0,0,13,0,0,1,0,"I-ao autor, o juiz decretará a nulidade do processo;"
41,1,2,1,0,0,13,0,0,2,0,"II-ao réu, reputar-se-á revel;"
42,1,2,1,0,0,13,0,0,3,0,"III-ao terceiro, será excluído do processo."
43,1,2,2,0,0,14,0,0,0,0,"Art. 14. Sãodeveres das partes e de todos aqueles que de qualquer forma participam do processo: (Redação dada pela Lei nº 10.358, de 2001)"
44,1,2,2,0,0,14,0,0,1,0,I-expor os fatos em juízo conforme a verdade;
45,1,2,2,0,0,14,0,0,2,0,II-proceder com lealdade e boa-fé;
46,1,2,2,0,0,14,0,0,3,0,"III-não formular pretensões, nem alegar defesa, cientes de que sãodestituídas de fundamento;"
47,1,2,2,0,0,14,0,0,4,0,"IV-não produzir provas, nem praticar atos inúteis ou desnecessários àdeclaração ou defesa do direito."
48,1,2,2,0,0,14,0,1,0,0,"Parágrafo único. Ressalvados os advogados que se sujeitam exclusivamente aos estatutosda OAB, a violação do disposto no inciso V deste artigo constitui ato atentatório aoexercício da jurisdição, podendo o juiz, sem prejuízo das sanções criminais, civise processuais cabíveis, aplicar ao responsável multa em montante a ser fixado deacordo com a gravidade da conduta e não superior a vinte por cento do valor da causa;não sendo paga no prazo estabelecido, contado do trânsito em julgado dadecisão final da causa, a multa será inscrita sempre como dívida ativa da União ou doEstado. (Incluído pela Lei nº 10.358, de 2001)"
49,1,2,2,0,0,15,0,0,0,0,"Art.15.É defeso às partes e seus advogados empregar expressõesinjuriosas nos escritos apresentados no processo, cabendo ao juiz, de ofício ou arequerimento do ofendido, mandar riscá-las."
50,1,2,2,0,0,15,0,1,0,0,"Parágrafo único.Quando as expressões injuriosas forem proferidas em defesaoral, o juiz advertirá o advogado que não as use, sob pena de Ihe ser cassada a palavra."
51,1,2,2,0,0,16,0,0,0,0,"Art.16.Responde por perdas e danos aquele que pleitear de má-fécomo autor, réu ou interveniente."
52,1,2,2,0,0,17,0,0,0,0,"Art.17.Reputa-selitigante de má-fé aquele que: (Redação dada pelaLei nº 6.771, de 1980)"
53,1,2,2,0,0,17,0,0,1,0,"I-deduzir pretensão ou defesa contra texto expresso de lei ou fatoincontroverso; (Redação dada pela Lei nº 6.771, de1980)"
54,1,2,2,0,0,17,0,0,2,0,"II-alterar a verdade dos fatos; (Redaçãodada pela Lei nº 6.771, de 1980)"
55,1,2,2,0,0,17,0,0,3,0,"III-usar do processo para conseguir objetivo ilegal; (Redação dada pela Lei nº 6.771, de 1980)"
56,1,2,2,0,0,17,0,0,4,0,"IV-opuser resistência injustificada ao andamento do processo; (Redação dada pela Lei nº 6.771, de 1980)"
57,1,2,2,0,0,17,0,0,5,0,"V-proceder de modo temerário em qualquer incidente ou ato do processo; (Redação dada pela Lei nº 6.771, de 1980)"
58,1,2,2,0,0,17,0,0,6,0,"Vl-provocar incidentes manifestamente infundados. (Redação dada pela Lei nº 6.771, de 1980)"
59,1,2,2,0,0,17,0,0,7,0,"VII-interpuser recurso comintuito manifestamente protelatório. (Incluído pela Lei nº 9.668, de1998)"
60,1,2,2,0,0,18,0,0,0,0,"Art. 18. O juiz ou tribunal, deofício ou a requerimento, condenará o litigante de má-fé a pagar multa não excedentea um por cento sobre o valor da causa e a indenizar a parte contrária dos prejuízos queesta sofreu, mais os honorários advocatícios e todas as despesas que efetuou. (Redaçãodada pela Lei nº 9.668, de 1998)"
61,1,2,2,0,0,18,0,1,0,0,"§1oQuando forem dois ou mais os litigantes demá-fé, o juiz condenará cada um na proporção do seu respectivo interesse na causa, ousolidariamente aqueles que se coligaram para lesar a parte contrária."
62,1,2,2,0,0,18,0,2,0,0,">§2oOvalor da indenização será desde logo fixado pelo juiz, em quantia não superior a 20%(vinte por cento) sobre o valor da causa, ou liquidado por arbitramento. (Redação dada pela Lei nº 8.952, de 1994)"
63,1,2,2,0,0,19,0,0,0,0,"Art.19.Salvo as disposições concernentes à justiça gratuita,cabe às partes prover as despesas dos atos que realizam ou requerem no processo,antecipando-lhes o pagamento desde o início até sentença final; e bem ainda, naexecução, até a plena satisfação do direito declarado pela sentença."
64,1,2,2,0,0,19,0,1,0,0,§1oO pagamento de que trata este artigo será feitopor ocasião de cada ato processual.
65,1,2,2,0,0,19,0,2,0,0,"§2oCompete ao autor adiantar as despesas relativas aatos, cuja realização o juiz determinar de ofício ou a requerimento do MinistérioPúblico."
66,1,2,2,0,0,20,0,0,0,0,"Art. 20. A sentença condenará ovencido a pagar ao vencedor as despesas que antecipou e os honorários advocatícios. Estaverba honorária será devida, também, nos casos em que o advogado funcionar em causaprópria. (Redação dada pela Lei nº 6.355, de 1976)"
67,1,2,2,0,0,20,0,1,0,0," §1º O juiz, ao decidir qualquer incidente ou recurso, condenará nas despesas o vencido. (Redação dada pela Lei nº 5.925, de 1973)"
68,1,2,2,0,0,20,0,2,0,0," §2º As despesas abrangem não só as custas dos atos do processo, como também aindenização de viagem, diária de testemunha e remuneração do assistente técnico. (Redação dada pela Lei nº 5.925, de 1973)"
69,1,2,2,0,0,20,0,3,0,0," §3º Os honorários serão fixados entre o mínimo de dez por cento (10%) e o máximo devinte por cento (20%) sobre o valor da condenação, atendidos: (Redação dada pela Lei nº 5.925, de 1973)"
70,1,2,2,0,0,20,0,3,0,1," a)o grau de zelo do profissional; (Redação dada pelaLei nº 5.925, de 1973)"
71,1,2,2,0,0,20,0,3,0,2," b)o lugar de prestação do serviço; (Redação dadapela Lei nº 5.925, de 1973)"
72,1,2,2,0,0,20,0,3,0,3," c)a natureza e importância da causa, o trabalho realizado pelo advogado e o tempo exigidopara o seu serviço. (Redação dada pela Lei nº5.925, de 1973)"
73,1,2,2,0,0,20,0,4,0,0,">§4oNascausas de pequeno valor, nas de valor inestimável, naquelas em que não houvercondenação ou for vencida a Fazenda Pública, e nas execuções, embargadas ou não, oshonorários serão fixados consoante apreciação eqüitativa do juiz, atendidas as normasdas alíneas a, b e c do parágrafo anterior. (Redação dadapela Lei nº 8.952, de 1994)"
74,1,2,2,0,0,20,0,5,0,0,">§5oNasações de indenização por ato ilícito contra pessoa, o valor da condenação será asoma das prestações vencidas com o capital necessário a produzir a renda correspondenteàs prestações vincendas (art. 602), podendo estas ser pagas, também mensalmente, naforma do §2o do referido art. 602, inclusive em consignação nafolha de pagamentos do devedor. (Incluído pela Lei nº 6.745, de 1979) (Vide §2º do art 475-Q)"
75,1,2,2,0,0,21,0,0,0,0,"Art.21.Se cada litigante for em parte vencedor e vencido, serãorecíproca e proporcionalmente distribuídos e compensados entre eles os honorários e asdespesas."
76,1,2,2,0,0,21,0,1,0,0,"Parágrafo único.Se um litigante decair de parte mínima do pedido, o outroresponderá, por inteiro, pelas despesas e honorários."
77,1,2,2,0,0,22,0,0,0,0,"Art.22.O réu que, por não argüirna sua resposta fato impeditivo, modificativo ou extintivo do direito do autor, dilatar ojulgamento da lide, será condenado nas custas a partir do saneamento do processo eperderá, ainda que vencedor na causa, o direito a haver do vencido honoráriosadvocatícios. (Redação dada pela Lei nº 5.925, de 1973)"
78,1,2,2,0,0,23,0,0,0,0,"Art.23.Concorrendo diversos autores ou diversos réus, os vencidosrespondem pelas despesas e honorários em proporção."
79,1,2,2,0,0,24,0,0,0,0,"Art.24.Nos procedimentos de jurisdição voluntária, as despesas serãoadiantadas pelo requerente, mas rateadas entre os interessados."
80,1,2,2,0,0,25,0,0,0,0,"Art.25.Nos juízos divisórios, não havendo litígio, os interessadospagarão as despesas proporcionalmente aos seus quinhões."
81,1,2,2,0,0,26,0,0,0,0,"Art.26.Se o processo terminar por desistência ou reconhecimento dopedido, as despesas e os honorários serão pagos pela parte que desistiu ou reconheceu."
82,1,2,2,0,0,26,0,1,0,0,"§1oSendo parcial a desistência ou o reconhecimento,a responsabilidade pelas despesas e honorários será proporcional à parte de que sedesistiu ou que se reconheceu."
83,1,2,2,0,0,26,0,2,0,0,"§2oHavendo transação e nada tendo as partesdisposto quanto às despesas, estas serão divididas igualmente."
84,1,2,2,0,0,27,0,0,0,0,"Art.27.As despesas dos atos processuais, efetuados a requerimento doMinistério Público ou da Fazenda Pública, serão pagas a final pelo vencido."
85,1,2,2,0,0,28,0,0,0,0,"Art.28.Quando, a requerimento do réu, o juiz declarar extinto oprocesso sem julgar o mérito (art. 267, §2o), o autor nãopoderá intentar de novo a ação, sem pagar ou depositar em cartório as despesas e oshonorários, em que foi condenado."
86,1,2,2,0,0,29,0,0,0,0,"Art.29.As despesas dos atos, que forem adiados ou tiverem de repetir-se,ficarão a cargo da parte, do serventuário, do órgão do Ministério Público ou do juizque, sem justo motivo, houver dado causa ao adiamento ou à repetição."
87,1,2,2,0,0,30,0,0,0,0,"Art.30.Quem receber custas indevidas ou excessivas é obrigado arestituí-las, incorrendo em multa equivalente ao dobro de seu valor."
88,1,2,2,0,0,31,0,0,0,0,"Art.31.As despesas dos atos manifestamente protelatórios, impertinentesou supérfluos serão pagas pela parte que os tiver promovido ou praticado, quandoimpugnados pela outra."
89,1,2,2,0,0,32,0,0,0,0,"Art.32.Se o assistido ficar vencido, o assistente será condenado nascustas em proporção à atividade que houver exercido no processo."
90,1,2,2,0,0,33,0,0,0,0,"Art.33.Cada parte pagará a remuneração do assistente técnico quehouver indicado; a do perito será paga pela parte que houver requerido o exame, ou peloautor, quando requerido por ambas as partes ou determinado de ofício pelo juiz."
91,1,2,2,0,0,34,0,0,0,0,"Art.34.Aplicam-se à reconvenção, à oposição, à açãodeclaratória incidental e aos procedimentos de jurisdição voluntária, no que couber,as disposições constantes desta seção. (Redaçãodada pela Lei nº 5.925, de 1973)"
92,1,2,2,0,0,35,0,0,0,0,Art.35.As sanções impostas às partes emconseqüência de má-fé serão contadas como custas e reverterão em benefício da partecontrária; as impostas aos serventuários pertencerão ao Estado.
93,1,2,3,0,0,36,0,0,0,0,"Art.36.A parte será representada em juízo por advogado legalmentehabilitado. Ser-lhe-á lícito, no entanto, postular em causa própria, quando tiverhabilitação legal ou, não a tendo, no caso de falta de advogado no lugar ou recusa ouimpedimento dos que houver."
94,1,2,3,0,0,36,0,1,0,0,">§§1oe 2o.  (Revogados pela Lei nº 9.649, de1998)"
95,1,2,3,0,0,37,0,0,0,0,"Art.37.Sem instrumento de mandato, o advogado não será admitido aprocurar em juízo. Poderá, todavia, em nome da parte, intentar ação, a fim de evitardecadência ou prescrição, bem como intervir, no processo, para praticar atos reputadosurgentes. Nestes casos, o advogado se obrigará, independentemente de caução, a exibir oinstrumento de mandato no prazo de 15 (quinze) dias, prorrogável até outros 15 (quinze),por despacho do juiz."
96,1,2,3,0,0,37,0,1,0,0,"Parágrafo único.Os atos, não ratificados no prazo, serão havidos porinexistentes, respondendo o advogado por despesas e perdas e danos."
97,1,2,3,0,0,38,0,0,0,0,"Art. 38. A procuração geral para oforo, conferida por instrumento público, ou particular assinado pela parte, habilita oadvogado a praticar todos os atos do processo, salvo para receber citação inicial,confessar, reconhecer a procedência do pedido, transigir, desistir, renunciar ao direitosobre que se funda a ação, receber, dar quitação e firmar compromisso. (Redaçãodada pela Lei nº 8.952, de 1994)"
98,1,2,3,0,0,38,0,1,0,0,"Parágrafo único. A procuração pode ser assinada digitalmente com base em certificado emitido por Autoridade Certificadora credenciada, na forma da lei específica. (Incluído pela Lei nº 11.419, de 2006)."
99,1,2,3,0,0,39,0,0,0,0,"Art.39.Compete ao advogado, ou à parte quando postular em causaprópria:"
100,1,2,3,0,0,39,0,0,1,0,"I-declarar, na petição inicial ou na contestação, o endereço em quereceberá intimação;"
101,1,2,3,0,0,39,0,0,2,0,II-comunicar ao escrivão do processo qualquer mudança de endereço.
102,1,2,3,0,0,39,0,1,0,0,"Parágrafo único.Se o advogado não cumprir o disposto no noI deste artigo, o juiz, antes de determinar a citação do réu, mandará que se supra aomissão no prazo de 48 (quarenta e oito) horas, sob pena de indeferimento da petição;se infringir o previsto no no II, reputar-se-ão válidas asintimações enviadas, em carta registrada, para o endereço constante dos autos."
103,1,2,3,0,0,40,0,0,0,0,Art.40.O advogado tem direito de:
104,1,2,3,0,0,40,0,0,1,0,"I-examinar, em cartório de justiça e secretaria de tribunal, autos dequalquer processo, salvo o disposto no art. 155;"
105,1,2,3,0,0,40,0,0,2,0,"II-requerer, como procurador, vista dos autos de qualquer processo pelo prazode 5 (cinco) dias;"
106,1,2,3,0,0,40,0,0,3,0,"III-retirar os autos do cartório ou secretaria, pelo prazo legal, sempre queIhe competir falar neles por determinação do juiz, nos casos previstos em lei."
107,1,2,3,0,0,40,0,1,0,0,"§1oAo receber os autos, o advogado assinará carga nolivro competente."
108,1,2,3,0,0,40,0,2,0,0,">§ 2o Sendo comum às partes o prazo, só em conjunto ou mediante prévio ajuste por petição nos autos, poderão os seus procuradores retirar os autos, ressalvada a obtenção de cópias para a qual cada procurador poderá retirá-los pelo prazo de 1 (uma) hora independentemente de ajuste.(Redação dada pela Lei nº 11.969, de 2009)"
109,1,2,4,0,0,41,0,0,0,0,"Art.41.Só é permitida, no curso do processo, a substituiçãovoluntária das partes nos casos expressos em lei."
110,1,2,4,0,0,42,0,0,0,0,"Art.42.A alienação da coisa ou do direito litigioso, a títuloparticular, por ato entre vivos, não altera a legitimidade das partes."
111,1,2,4,0,0,42,0,1,0,0,"§1oO adquirente ou o cessionário não poderáingressar em juízo, substituindo o alienante, ou o cedente, sem que o consinta a partecontrária."
112,1,2,4,0,0,42,0,2,0,0,"§2oO adquirente ou o cessionário poderá, noentanto, intervir no processo, assistindo o alienante ou o cedente."
113,1,2,4,0,0,42,0,3,0,0,"§3oA sentença, proferida entre as partesoriginárias, estende os seus efeitos ao adquirente ou ao cessionário."
114,1,2,4,0,0,43,0,0,0,0,"Art.43.Ocorrendo a morte de qualquer das partes, dar-se-á asubstituição pelo seu espólio ou pelos seus sucessores, observado o disposto no art.265."
115,1,2,4,0,0,44,0,0,0,0,"Art.44.A parte, que revogar o mandato outorgado ao seu advogado, nomesmo ato constituirá outro que assuma o patrocínio da causa."
116,1,2,4,0,0,45,0,0,0,0,"Art. 45. O advogado poderá, aqualquer tempo, renunciar ao mandato, provando que cientificou o mandante a fim de queeste nomeie substituto. Durante os 10 (dez) dias seguintes, o advogado continuará arepresentar o mandante, desde que necessário para Ihe evitar prejuízo. (Redaçãodada pela Lei nº 8.952, de 1994)"
117,1,2,5,0,0,46,0,0,0,0,"Art.46.Duas ou mais pessoas podem litigar, no mesmo processo, emconjunto, ativa ou passivamente, quando:"
118,1,2,5,0,0,46,0,0,1,0,I-entre elas houver comunhão de direitos ou de obrigações relativamente àlide;
119,1,2,5,0,0,46,0,0,2,0,II-os direitos ou as obrigações derivarem do mesmo fundamento de fato ou dedireito;
120,1,2,5,0,0,46,0,0,3,0,III-entre as causas houver conexão pelo objeto ou pela causa de pedir;
121,1,2,5,0,0,46,0,0,4,0,IV-ocorrer afinidade de questões por um ponto comum de fato ou de direito.
122,1,2,5,0,0,47,0,0,0,0,"Art.47.Há litisconsórcio necessário, quando, por disposição de leiou pela natureza da relação jurídica, o juiz tiver de decidir a lide de modo uniformepara todas as partes; caso em que a eficácia da sentença dependerá da citação detodos os litisconsortes no processo."
123,1,2,5,0,0,47,0,1,0,0,"Parágrafo único.O juiz ordenará ao autor que promova a citação de todosos litisconsortes necessários, dentro do prazo que assinar, sob pena de declarar extintoo processo."
124,1,2,5,0,0,48,0,0,0,0,"Art.48.Salvo disposição em contrário, os litisconsortes serãoconsiderados, em suas relações com a parte adversa, como litigantes distintos; os atos eas omissões de um não prejudicarão nem beneficiarão os outros."
125,1,2,5,0,0,49,0,0,0,0,Art.49.Cada litisconsorte tem o direito de promover o andamento doprocesso e todos devem ser intimados dos respectivos atos.
126,1,2,5,0,0,50,0,0,0,0,"Art.50.Pendendo uma causa entre duas ou mais pessoas, o terceiro, quetiver interesse jurídico em que a sentença seja favorável a uma delas, poderá intervirno processo para assisti-la."
127,1,2,5,0,0,50,0,1,0,0,Parágrafo único.A assistência tem lugar em qualquer dos tipos deprocedimento e em todos os graus da jurisdição; mas o assistente recebe o processo noestado em que se encontra.
128,1,2,5,0,0,51,0,0,0,0,"Art.51.Não havendo impugnação dentro de 5 (cinco) dias, o pedido doassistente será deferido. Se qualquer das partes alegar, no entanto, que falece aoassistente interesse jurídico para intervir a bem do assistido, o juiz:"
129,1,2,5,0,0,51,0,0,1,0,"I-determinará, sem suspensão do processo, o desentranhamento da petição eda impugnação, a fim de serem autuadas em apenso;"
130,1,2,5,0,0,51,0,0,2,0,II-autorizará a produção de provas;
131,1,2,5,0,0,51,0,0,3,0,"III-decidirá, dentro de 5 (cinco) dias, o incidente."
132,1,2,5,0,0,52,0,0,0,0,"Art.52.O assistente atuará como auxiliar da parte principal, exerceráos mesmos poderes e sujeitar-se-á aos mesmos ônus processuais que o assistido."
133,1,2,5,0,0,52,0,1,0,0,"Parágrafo único.Sendo revel o assistido, o assistente será considerado seugestor de negócios."
134,1,2,5,0,0,53,0,0,0,0,"Art.53.A assistência não obsta a que a parte principal reconheça aprocedência do pedido, desista da ação ou transija sobre direitos controvertidos; casosem que, terminando o processo, cessa a intervenção do assistente."
135,1,2,5,0,0,54,0,0,0,0,"Art.54.Considera-se litisconsorte da parte principal o assistente, todavez que a sentença houver de influir na relação jurídica entre ele e o adversário doassistido."
136,1,2,5,0,0,54,0,1,0,0,"Parágrafo único.Aplica-se ao assistente litisconsorcial, quanto ao pedido deintervenção, sua impugnação e julgamento do incidente, o disposto no art. 51."
137,1,2,5,0,0,55,0,0,0,0,"Art.55.Transitada em julgado a sentença, na causa em que interveio oassistente, este não poderá, em processo posterior, discutir a justiça da decisão,salvo se alegar e provar que:"
138,1,2,5,0,0,55,0,0,1,0,"I-pelo estado em que recebera o processo, ou pelas declarações e atos doassistido, fora impedido de produzir provas suscetíveis de influir na sentença;"
139,1,2,5,0,0,55,0,0,2,0,"II-desconhecia a existência de alegações ou de provas, de que o assistido,por dolo ou culpa, não se valeu."
140,1,2,6,0,0,56,0,0,0,0,"Art.56.Quem pretender, no todo ou em parte, a coisa ou o direito sobreque controvertem autor e réu, poderá, até ser proferida a sentença, ofereceroposição contra ambos."
141,1,2,6,0,0,57,0,0,0,0,"Art.57.O opoente deduzirá o seu pedido, observando os requisitosexigidos para a propositura da ação (arts. 282 e 283). Distribuída a oposição pordependência, serão os opostos citados, na pessoa dos seus respectivos advogados, paracontestar o pedido no prazo comum de 15 (quinze) dias."
142,1,2,6,0,0,57,0,1,0,0,"Parágrafo único.Se o processo principal correr à revelia do réu, esteserá citado na forma estabelecida no Título V, Capítulo IV, Seção III, deste Livro."
143,1,2,6,0,0,58,0,0,0,0,"Art.58.Se um dos opostos reconhecer a procedência do pedido, contra ooutro prosseguirá o opoente."
144,1,2,6,0,0,59,0,0,0,0,"Art.59.A oposição, oferecida antes da audiência, será apensada aosautos principais e correrá simultaneamente com a ação, sendo ambas julgadas pela mesmasentença."
