'id','livro','titulo','capitulo','secao','subsecao','artigo','sub_artigo','paragrafo','inciso','alinea','texto'
1207,1,8,10,0,7,471,10,1,0,0,">§1o Do auto de penhora e de avaliação será de imediato intimado oexecutado, na pessoa de seu advogado (arts. 236 e 237), ou, na falta deste, o seurepresentante legal, ou pessoalmente, por mandado ou pelo correio, podendo oferecerimpugnação, querendo, no prazo de quinze dias. (Incluído pela Lei nº 11.232, de 2005)"
1208,1,8,10,0,7,471,10,2,0,0,">§2o Caso o oficial de justiça não possa proceder à avaliação, pordepender de conhecimentos especializados, o juiz, de imediato, nomeará avaliador,assinando-lhe breve prazo para a entrega do laudo. (Incluído pela Lei nº 11.232, de 2005)"
1209,1,8,10,0,7,471,10,3,0,0,">§3o O exeqüente poderá, em seu requerimento, indicar desde logo os bensa serem penhorados. (Incluído pelaLei nº 11.232, de 2005)"
1210,1,8,10,0,7,471,10,4,0,0,">§4o Efetuado o pagamento parcial no prazo previsto no caput deste artigo,a multa de dez por cento incidirá sobre o restante. (Incluído pela Lei nº 11.232, de 2005)"
1211,1,8,10,0,7,471,10,5,0,0,">§5o Não sendo requerida a execução no prazo de seis meses, o juizmandará arquivar os autos, sem prejuízo de seu desarquivamento a pedido da parte. (Incluído pela Lei nº 11.232, de 2005)"
1212,1,8,10,0,7,471,11,0,0,0,"Art.475-L. A impugnação somente poderá versar sobre: (Incluído pela Lei nº 11.232, de 2005)"
1213,1,8,10,0,7,471,11,1,0,0,">§1o Para efeito do disposto no inciso II do caput deste artigo,considera-se também inexigível o título judicial fundado em lei ou ato normativodeclarados inconstitucionais pelo Supremo Tribunal Federal, ou fundado em aplicação ouinterpretação da lei ou ato normativo tidas pelo Supremo Tribunal Federal comoincompatíveis com a Constituição Federal. (Incluído pela Lei nº 11.232, de 2005)"
1214,1,8,10,0,7,471,11,2,0,0," §2o Quando o executado alegar que o exeqüente, em excesso de execução,pleiteia quantia superior à resultante da sentença, cumprir-lhe-á declarar de imediatoo valor que entende correto, sob pena de rejeição liminar dessa impugnação. (Incluído pela Lei nº 11.232, de 2005)"
1215,1,8,10,0,7,471,12,0,0,0,"Art.475-M. A impugnação não terá efeito suspensivo, podendo o juiz atribuir-lhe tal efeitodesde que relevantes seus fundamentos e o prosseguimento da execução seja manifestamentesuscetível de causar ao executado grave dano de difícil ou incerta reparação. (Incluído pela Lei nº 11.232, de 2005)"
1216,1,8,10,0,7,471,12,1,0,0,"§1o Ainda que atribuído efeito suspensivo à impugnação, é lícito aoexeqüente requerer o prosseguimento da execução, oferecendo e prestando cauçãosuficiente e idônea, arbitrada pelo juiz e prestada nos próprios autos. (Incluído pela Lei nº 11.232, de 2005)"
1217,1,8,10,0,7,471,12,2,0,0,"§2o Deferido efeito suspensivo, a impugnação será instruída edecidida nos próprios autos e, caso contrário, em autos apartados. (Incluído pela Lei nº 11.232, de 2005)"
1218,1,8,10,0,7,471,12,3,0,0,"§3o A decisão que resolver a impugnação é recorrível mediante agravode instrumento, salvo quando importar extinção da execução, caso em que caberáapelação. (Incluído pela Lei nº11.232, de 2005)"
1219,1,8,10,0,7,471,13,0,0,0,"Art.475-N. São títulos executivos judiciais: (Incluído pela Lei nº 11.232, de 2005)"
1220,1,8,10,0,7,471,14,0,0,0,"Art.475-O. A execução provisória da sentença far-se-á, no que couber, do mesmo modo que adefinitiva, observadas as seguintes normas: (Incluído pela Lei nº 11.232, de 2005)"
1221,1,8,10,0,7,471,14,1,0,0," §1o No caso do inciso II do caput deste artigo, se a sentençaprovisória for modificada ou anulada apenas em parte, somente nesta ficará sem efeito aexecução. (Incluído pela Lei nº11.232, de 2005)"
1222,1,8,10,0,7,471,14,2,0,0," §2o A caução a que se refere o inciso III do caput deste artigo poderáser dispensada: (Incluído pela Leinº 11.232, de 2005)"
1223,1,8,10,0,7,471,15,0,0,0,"Art.475-P. O cumprimento da sentença efetuar-se-á perante: (Incluído pela Lei nº 11.232, de 2005)"
1224,1,8,10,0,7,471,16,0,0,0,"Art.475-Q. Quando a indenização por ato ilícito incluir prestação de alimentos, o juiz,quanto a esta parte, poderá ordenar ao devedor constituição de capital, cuja rendaassegure o pagamento do valor mensal da pensão. (Incluído pela Lei nº 11.232, de 2005)"
1225,1,8,10,0,7,471,16,1,0,0," §1o Este capital, representado por imóveis, títulos da dívida públicaou aplicações financeiras em banco oficial, será inalienável e impenhorável enquantodurar a obrigação do devedor. (Incluídopela Lei nº 11.232, de 2005)"
1226,1,8,10,0,7,471,16,2,0,0," §2o O juiz poderá substituir a constituição do capital pela inclusãodo beneficiário da prestação em folha de pagamento de entidade de direito público oude empresa de direito privado de notória capacidade econômica, ou, a requerimento dodevedor, por fiança bancária ou garantia real, em valor a ser arbitrado de imediato pelojuiz. (Incluído pela Lei nº 11.232,de 2005)"
1227,1,8,10,0,7,471,16,3,0,0," §3o Se sobrevier modificação nas condições econômicas, poderá aparte requerer, conforme as circunstâncias, redução ou aumento da prestação. (Incluído pela Lei nº 11.232, de 2005)"
1228,1,8,10,0,7,471,16,4,0,0," §4o Os alimentos podem ser fixados tomando por base o salário-mínimo. (Incluído pela Lei nº 11.232, de 2005)"
1229,1,8,10,0,7,471,16,5,0,0," §5o Cessada a obrigação de prestar alimentos, o juiz mandará liberar ocapital, cessar o desconto em folha ou cancelar as garantias prestadas. (Incluído pela Lei nº 11.232, de 2005)"
1230,1,8,10,0,7,471,17,0,0,0,"Art.475-R. Aplicam-se subsidiariamente ao cumprimento da sentença, no que couber, as normasque regem o processo de execução de título extrajudicial. (Incluído pela Lei nº 11.232, de 2005)"
1231,1,9,1,0,7,472,0,0,0,0,"Art.476.Compete a qualquer juiz, ao dar o voto na turma, câmara, ougrupo de câmaras, solicitar o pronunciamento prévio do tribunal acerca dainterpretação do direito quando:"
1232,1,9,1,0,7,472,0,0,1,0,"I-verificar que, a seu respeito, ocorre divergência;"
1233,1,9,1,0,7,472,0,0,2,0,"II-no julgamento recorrido a interpretação for diversa da que Ihe haja dadooutra turma, câmara, grupo de câmaras ou câmaras cíveis reunidas."
1234,1,9,1,0,7,472,0,1,0,0,"Parágrafo único.A parte poderá, ao arrazoar o recurso ou em petiçãoavulsa, requerer, fundamentadamente, que o julgamento obedeça ao disposto neste artigo."
1235,1,9,1,0,7,473,0,0,0,0,"Art.477.Reconhecida a divergência, será lavrado o acórdão, indo osautos ao presidente do tribunal para designar a sessão de julgamento. A secretariadistribuirá a todos os juízes cópia do acórdão."
1236,1,9,1,0,7,474,0,0,0,0,"Art.478.O tribunal, reconhecendo a divergência, dará a interpretaçãoa ser observada, cabendo a cada juiz emitir o seu voto em exposição fundamentada."
1237,1,9,1,0,7,474,0,1,0,0,"Parágrafo único.Em qualquer caso, será ouvido o chefe do MinistérioPúblico que funciona perante o tribunal."
1238,1,9,1,0,7,475,0,0,0,0,"Art.479.O julgamento, tomado pelo voto da maioria absoluta dos membrosque integram o tribunal, será objeto de súmula e constituirá precedente nauniformização da jurisprudência."
1239,1,9,1,0,7,475,0,1,0,0,Parágrafo único.Os regimentos internos disporão sobre a publicação noórgão oficial das súmulas de jurisprudência predominante.
1240,1,9,2,0,7,476,0,0,0,0,"Art.480.Argüida a inconstitucionalidade de lei ou de ato normativo dopoder público, o relator, ouvido o Ministério Público, submeterá a questão à turmaou câmara, a que tocar o conhecimento do processo."
1241,1,9,2,0,7,477,0,0,0,0,"Art.481.Se a alegação for rejeitada, prosseguirá o julgamento; se foracolhida, será lavrado o acórdão, a fim de ser submetida a questão ao tribunal pleno."
1242,1,9,2,0,7,477,0,1,0,0,"Parágrafo único. Os órgãosfracionários dos tribunais não submeterão ao plenário, ou ao órgão especial, aargüição de inconstitucionalidade, quando já houver pronunciamento destes ou doplenário do Supremo Tribunal Federal sobre a questão. (Incluído pela Leinº 9.756, de 1998)"
1243,1,9,2,0,7,478,0,0,0,0,"Art.482.Remetida a cópia do acórdão a todos os juízes, o presidentedo tribunal designará a sessão de julgamento."
1244,1,9,2,0,7,478,0,1,0,0,">§ 1o O MinistérioPúblico e as pessoas jurídicas de direito público responsáveis pela edição do atoquestionado, se assim o requererem, poderão manifestar-se no incidente deinconstitucionalidade, observados os prazos e condições fixados no Regimento Interno doTribunal. (Incluído pela Lei nº 9.868, de 1999)"
1245,1,9,2,0,7,478,0,2,0,0,"§ 2o Os titulares do direito de propositura referidos no art. 103 daConstituição poderão manifestar-se, por escrito, sobre a questão constitucional objetode apreciação pelo órgão especial ou pelo Pleno do Tribunal, no prazo fixado emRegimento, sendo-lhes assegurado o direito de apresentar memoriais ou de pedir a juntadade documentos. (Incluído pela Lei nº 9.868, de 1999)"
1246,1,9,2,0,7,478,0,3,0,0,"§ 3o O relator, considerando a relevância da matéria e a representatividadedos postulantes, poderá admitir, por despacho irrecorrível, a manifestação de outrosórgãos ou entidades. (Incluído pela Lei nº 9.868, de1999)"
1247,1,9,3,0,7,479,0,0,0,0,Art.483.A sentença proferida por tribunal estrangeiro não teráeficácia no Brasil senão depois de homologada pelo Supremo Tribunal Federal.
1248,1,9,3,0,7,479,0,1,0,0,Parágrafo único.A homologação obedecerá ao que dispuser o RegimentoInterno do Supremo Tribunal Federal.
1249,1,9,3,0,7,480,0,0,0,0,Art.484.A execução far-se-á por carta de sentença extraída dosautos da homologação e obedecerá às regras estabelecidas para a execução dasentença nacional da mesma natureza.
1250,1,9,4,0,7,481,0,0,0,0,"Art.485.A sentença de mérito, transitada em julgado, pode serrescindida quando:"
1251,1,9,4,0,7,481,0,0,1,0,"I-se verificar que foi dada por prevaricação, concussão ou corrupção dojuiz;"
1252,1,9,4,0,7,481,0,0,2,0,II-proferida por juiz impedido ou absolutamente incompetente;
1253,1,9,4,0,7,481,0,0,3,0,"III-resultar de dolo da parte vencedora em detrimento da parte vencida, ou decolusão entre as partes, a fim de fraudar a lei;"
1254,1,9,4,0,7,481,0,0,4,0,IV-ofender a coisa julgada;
1255,1,9,4,0,7,481,0,0,5,0,V-violar literal disposição de lei;
1256,1,9,4,0,7,481,0,0,6,0,"Vl-se fundar em prova, cuja falsidade tenha sido apurada em processo criminalou seja provada na própria ação rescisória;"
1257,1,9,4,0,7,481,0,0,7,0,"Vll-depois da sentença, o autor obtiver documento novo, cuja existênciaignorava, ou de que não pôde fazer uso, capaz, por si só, de Ihe assegurarpronunciamento favorável;"
1258,1,9,4,0,7,481,0,0,8,0,"VIII-houver fundamento para invalidar confissão, desistência ou transação,em que se baseou a sentença;"
1259,1,9,4,0,7,481,0,0,9,0,"IX-fundada em erro de fato, resultante de atos ou de documentos da causa;"
1260,1,9,4,0,7,481,0,1,0,0,"§1oHá erro, quando a sentença admitir um fatoinexistente, ou quando considerar inexistente um fato efetivamente ocorrido."
1261,1,9,4,0,7,481,0,2,0,0,"§2oÉ indispensável, num como noutro caso, que nãotenha havido controvérsia, nem pronunciamento judicial sobre o fato."
1262,1,9,4,0,7,482,0,0,0,0,"Art.486.Os atos judiciais, que não dependem de sentença, ou em queesta for meramente homologatória, podem ser rescindidos, como os atos jurídicos emgeral, nos termos da lei civil."
1263,1,9,4,0,7,483,0,0,0,0,Art.487.Tem legitimidade para propor a ação:
1264,1,9,4,0,7,483,0,0,1,0,I-quem foi parte no processo ou o seu sucessor a título universal ousingular;
1265,1,9,4,0,7,483,0,0,2,0,II-o terceiro juridicamente interessado;
1266,1,9,4,0,7,483,0,0,3,0,III-o Ministério Público:
1267,1,9,4,0,7,483,0,0,3,1," a)se não foi ouvido no processo, em que Ihe era obrigatória a intervenção;"
1268,1,9,4,0,7,483,0,0,3,2," b)quando a sentença é o efeito de colusão das partes, a fim de fraudar a lei."
1269,1,9,4,0,7,484,0,0,0,2,"Art.488.A petição inicial será elaborada com observância dosrequisitos essenciais do art. 282, devendo o autor:"
1270,1,9,4,0,7,484,0,0,1,0,"I-cumular ao pedido de rescisão, se for o caso, o de novo julgamento dacausa;"
1271,1,9,4,0,7,484,0,0,2,0,"II-depositar a importância de 5% (cinco por cento) sobre o valor da causa, atítulo de multa, caso a ação seja, por unanimidade de votos, declarada inadmissível,ou improcedente."
1272,1,9,4,0,7,484,0,1,0,0,"Parágrafo único.Não se aplica o disposto no no II àUnião, ao Estado, ao Município e ao Ministério Público."
1273,1,9,4,0,7,485,0,0,0,0,"Art. 489. O ajuizamento da ação rescisória não impede ocumprimento da sentença ou acórdão rescindendo, ressalvada a concessão, casoimprescindíveis e sob os pressupostos previstos em lei, de medidas de natureza cautelarou antecipatória de tutela. (Redaçãodada pela Lei nº 11.280, de 2006)"
1274,1,9,4,0,7,486,0,0,0,0,Art.490.Será indeferida a petição inicial:
1275,1,9,4,0,7,486,0,0,1,0,I-nos casos previstos no art. 295;
1276,1,9,4,0,7,486,0,0,2,0,"II-quando não efetuado o depósito, exigido pelo art. 488, II."
1277,1,9,4,0,7,487,0,0,0,0,"Art.491.O relator mandará citar o réu, assinando-lhe prazo nuncainferior a 15 (quinze) dias nem superior a 30 (trinta) para responder aos termos daação. Findo o prazo com ou sem resposta, observar-se-á no que couber o disposto noLivro I, Título VIII, Capítulos IV e V."
1278,1,9,4,0,7,488,0,0,0,0,"Art.492.Se os fatos alegados pelas partes dependerem de prova, o relatordelegará a competência ao juiz de direito da comarca onde deva ser produzida, fixandoprazo de 45 (quarenta e cinco) a 90 (noventa) dias para a devolução dos autos."
1279,1,9,4,0,7,489,0,0,0,0,"Art.493.Concluída a instrução, será aberta vista, sucessivamente, aoautor e ao réu, pelo prazo de 10 (dez) dias, para razões finais. Em seguida, os autossubirão ao relator, procedendo-se ao julgamento:"
1280,1,9,4,0,7,489,0,0,1,0,"I - no Supremo Tribunal Federal eno Superior Tribunal de Justiça, na forma dos seus regimentos internos; (Redação dada pela Lei nº 11.382, de2006)."
1281,1,9,4,0,7,489,0,0,2,0,"II-nos Estados, conforme dispuser a norma de Organização Judiciária."
1282,1,9,4,0,7,490,0,0,0,0,"Art.494.Julgando procedente a ação, o tribunal rescindirá asentença, proferirá, se for o caso, novo julgamento e determinará a restituição dodepósito; declarando inadmissível ou improcedente a ação, a importância do depósitoreverterá a favor do réu, sem prejuízo do disposto no art. 20."
1283,1,9,4,0,7,491,0,0,0,0,"Art.495.O direito de propor ação rescisória se extingue em 2 (dois)anos, contados do trânsito em julgado da decisão."
1284,1,10,1,0,7,492,0,0,0,0,"Art. 496. São cabíveisos seguintes recursos: (Redação dada pela Lei nº 8.038, de 1990)"
1285,1,10,1,0,7,492,0,0,1,0,I - apelação;
1286,1,10,1,0,7,492,0,0,2,0,"II - agravo; (Redação dada pela Lei nº8.950, de 1994)"
1287,1,10,1,0,7,492,0,0,3,0,III - embargosinfringentes;
1288,1,10,1,0,7,492,0,0,4,0,IV - embargos dedeclaração;
1289,1,10,1,0,7,492,0,0,5,0,V - recursoordinário; 
1290,1,10,1,0,7,492,0,0,6,0,"Vl-recurso especial; (Incluído pela Lei nº 8.038,de 1990)"
1291,1,10,1,0,7,492,0,0,7,0,"Vll-recurso extraordinário; (Incluído pelaLei nº 8.038, de 1990)"
1292,1,10,1,0,7,492,0,0,8,0,"VIII-embargos dedivergência em recurso especial e em recurso extraordinário. (Incluído pela Lei nº 8.950, de 1994)"
1293,1,10,1,0,7,493,0,0,0,0,"Art.497.O recursoextraordinário e o recurso especial não impedem a execução da sentença; ainterposição do agravo de instrumento não obsta o andamento do processo, ressalvado odisposto no art. 558 desta Lei. (Redação dada pela Lei nº 8.038, de1990)"
1294,1,10,1,0,7,493,0,1,0,0,"Parágrafo único. Quando não forem interpostos embargos infringentes, o prazo relativoà parte unânime da decisão terá como dia de início aquele em que transitar em julgadoa decisão por maioria de votos. (Incluído pela Leinº 10.352, de 2001)"
1295,1,10,1,0,7,494,0,0,0,0,"Art.499.O recurso pode ser interposto pela parte vencida, pelo terceiroprejudicado e pelo Ministério Público."
1296,1,10,1,0,7,494,0,1,0,0,§1oCumpre ao terceiro demonstrar o nexo deinterdependência entre o seu interesse de intervir e a relação jurídica submetida àapreciação judicial.
1297,1,10,1,0,7,494,0,2,0,0,"§2oO Ministério Público tem legitimidade pararecorrer assim no processo em que é parte, como naqueles em que oficiou como fiscal dalei."
1298,1,10,1,0,7,495,0,0,0,0,"Art.500.Cada parte interporá o recurso, independentemente, no prazo eobservadas as exigências legais. Sendo, porém, vencidos autor e réu, ao recursointerposto por qualquer deles poderá aderir a outra parte. O recurso adesivo ficasubordinado ao recurso principal e se rege pelas disposições seguintes: (Redação dada pela Lei nº 5.925, de 1973)"
1299,1,10,1,0,7,495,0,0,1,0,"I-será interposto perantea autoridade competente para admitir o recurso principal, no prazo de que a parte dispõepara responder; (Redação dada pela Lei nº 8.950,de 1994)"
1300,1,10,1,0,7,495,0,0,2,0,"II-será admissível naapelação, nos embargos infringentes, no recurso extraordinário e no recurso especial; (Redação dada pela Lei nº 8.038, de 1990)"
1301,1,10,1,0,7,495,0,0,3,0,"III-não será conhecido,se houver desistência do recurso principal, ou se for ele declarado inadmissível oudeserto. (Redação dada pela Lei nº 5.925, de 1973)"
1302,1,10,1,0,7,495,0,1,0,0,"Parágrafo único.Ao recurso adesivo se aplicam as mesmas regras do recursoindependente, quanto às condições de admissibilidade, preparo e julgamento no tribunalsuperior. (Redação dada pela Lei nº 5.925, de1973)"
1303,1,10,1,0,7,496,0,0,0,0,"Art.501.O recorrente poderá, a qualquer tempo, sem a anuência dorecorrido ou dos litisconsortes, desistir do recurso."
1304,1,10,1,0,7,497,0,0,0,0,Art.502.A renúncia ao direito de recorrer independe da aceitação daoutra parte.
1305,1,10,1,0,7,498,0,0,0,0,"Art.503.A parte, que aceitar expressa ou tacitamente a sentença ou adecisão, não poderá recorrer."
1306,1,10,1,0,7,498,0,1,0,0,"Parágrafo único.Considera-se aceitação tácita a prática, sem reservaalguma, de um ato incompatível com a vontade de recorrer."
1307,1,10,1,0,7,499,0,0,0,0,"Art. 504. Dos despachos não cabe recurso. (Redação dada pela Lei nº 11.276, de2006)"
1308,1,10,1,0,7,500,0,0,0,0,Art.505.A sentença pode ser impugnada no todo ou em parte.
1309,1,10,1,0,7,501,0,0,0,0,"Art.506.O prazo para a interposição do recurso, aplicável em todos oscasos o disposto no art. 184 e seus parágrafos, contar-se-á da data:"
1310,1,10,1,0,7,501,0,0,1,0,I-da leitura da sentença em audiência;
1311,1,10,1,0,7,501,0,0,2,0,"II-da intimação às partes, quando a sentença não for proferida emaudiência;"
1312,1,10,1,0,7,501,0,0,3,0,"III - da publicação do dispositivo do acórdão no órgãooficial. (Redação dada pela Lei nº11.276, de 2006)"
1313,1,10,1,0,7,501,0,1,0,0,"Parágrafo único. No prazo para ainterposição do recurso, a petição será protocolada em cartório ou segundo a normade organização judiciária, ressalvado o disposto no § 2o do art. 525desta Lei. (Redação dada pela Leinº 11.276, de 2006)"
1314,1,10,1,0,7,502,0,0,0,0,"Art.507.Se, durante o prazo para a interposição do recurso, sobreviero falecimento da parte ou de seu advogado, ou ocorrer motivo de força maior, que suspendao curso do processo, será tal prazo restituído em proveito da parte, do herdeiro ou dosucessor, contra quem começará a correr novamente depois da intimação."
1315,1,10,1,0,7,503,0,0,0,0,"Art. 508. Na apelação, nos embargosinfringentes, no recurso ordinário, no recurso especial, no recurso extraordinário e nosembargos de divergência, o prazo para interpor e para responder é de 15 (quinze) dias. (Redação dada pela Lei nº 8.950,de 1994)"
1316,1,10,1,0,7,503,0,1,0,0,"Parágrafo único. (Revogado pela Lei nº 6.314,de 1975)"
1317,1,10,1,0,7,504,0,0,0,0,"Art.509.O recurso interposto por um dos litisconsortes a todosaproveita, salvo se distintos ou opostos os seus interesses."
1318,1,10,1,0,7,504,0,1,0,0,"Parágrafo único.Havendo solidariedade passiva, o recurso interposto por umdevedor aproveitará aos outros, quando as defesas opostas ao credor Ihes forem comuns."
1319,1,10,1,0,7,505,0,0,0,0,"Art.510.Transitado em julgado o acórdão, o escrivão, ou secretário,independentemente de despacho, providenciará a baixa dos autos ao juízo de origem, noprazo de 5 (cinco) dias."
1320,1,10,1,0,7,506,0,0,0,0,"Art. 511. No ato de interposição do recurso, o recorrentecomprovará, quando exigido pela legislação pertinente, o respectivo preparo, inclusiveporte de remessa e de retorno, sob pena de deserção. (Redaçãodada pela Lei nº 9.756, de 1998)"
1321,1,10,1,0,7,506,0,1,0,0,"§ 1o  São dispensados de preparo os recursos interpostos peloMinistério Público, pela União, pelos Estados e Municípios e respectivas autarquias, epelos que gozam de isenção legal. (Parágra único renumeradopela Lei nº 9.756, de 1998)"
1322,1,10,1,0,7,506,0,2,0,0,"§ 2o  A insuficiência no valor do preparo implicará deserção, se orecorrente, intimado, não vier a supri-lo no prazo de cinco dias. (Incluído pela Lei nº 9.756, de 1998)"
1323,1,10,1,0,7,507,0,0,0,0,Art.512.O julgamento proferido pelo tribunal substituirá a sentença oua decisão recorrida no que tiver sido objeto de recurso.
1324,1,10,2,0,7,508,0,0,0,0,Art.513.Da sentença caberá apelação (arts. 267 e 269).
1325,1,10,2,0,7,509,0,0,0,0,"Art.514.A apelação, interposta por petição dirigida ao juiz,conterá:"
1326,1,10,2,0,7,509,0,0,1,0,I-os nomes e a qualificação das partes;
1327,1,10,2,0,7,509,0,0,2,0,II-os fundamentos de fato e de direito;
1328,1,10,2,0,7,509,0,0,3,0,III-o pedido de nova decisão.
1329,1,10,2,0,7,509,0,1,0,0,"Parágrafo único. (Revogado pela Lei nº 8.950,de 1994)"
1330,1,10,2,0,7,510,0,0,0,0,Art.515.A apelação devolverá ao tribunal o conhecimento da matériaimpugnada.
1331,1,10,2,0,7,510,0,1,0,0,"§1oSerão, porém, objeto de apreciação ejulgamento pelo tribunal todas as questões suscitadas e discutidas no processo, ainda quea sentença não as tenha julgado por inteiro."
1332,1,10,2,0,7,510,0,2,0,0,"§2oQuando o pedido ou a defesa tiver mais de umfundamento e o juiz acolher apenas um deles, a apelação devolverá ao tribunal oconhecimento dos demais."
1333,1,10,2,0,7,510,0,3,0,0,">§ 3o Nos casos de extinção do processo sem julgamentodo mérito (art. 267), o tribunal pode julgar desde logo a lide, se a causa versarquestão exclusivamente de direito e estiver em condições de imediato julgamento. (Incluído pela Lei nº 10.352, de 2001)"
1334,1,10,2,0,7,510,0,4,0,0,"§ 4o Constatando a ocorrência de nulidade sanável, o tribunal poderádeterminar a realização ou renovação do ato processual, intimadas as partes; cumpridaa diligência, sempre que possível prosseguirá o julgamento da apelação. (Incluído pela Lei nº 11.276, de 2006)"
1335,1,10,2,0,7,511,0,0,0,0,"Art. 516. Ficam também submetidas aotribunal as questões anteriores à sentença, ainda não decididas. (Redação dada pela Lei nº 8.950, de 1994)"
1336,1,10,2,0,7,512,0,0,0,0,"Art.517.As questões de fato, não propostas no juízo inferior,poderão ser suscitadas na apelação, se a parte provar que deixou de fazê-lo por motivode força maior."
1337,1,10,2,0,7,513,0,0,0,0,"Art. 518. Interposta aapelação, o juiz, declarando os efeitos em que a recebe, mandará dar vista ao apeladopara responder. (Redação dada pela Lei nº8.950, de 1994)"
1338,1,10,2,0,7,513,0,1,0,0,"§ 1o O juiz não receberá o recurso de apelação quando a sentençaestiver em conformidade com súmula do Superior Tribunal de Justiça ou do SupremoTribunal Federal. (Renumerado pela Leinº 11.276, de 2006)"
1339,1,10,2,0,7,513,0,2,0,0," § 2oApresentada a resposta, é facultado ao juiz, em cinco dias, o reexame dospressupostos de admissibilidade do recurso. (Incluído pela Lei nº 11.276, de 2006)"
1340,1,10,2,0,7,513,0,3,0,0,"Parágrafo único.A decisão referida neste artigo será irrecorrível,cabendo ao tribunal apreciar-lhe a legitimidade. (Incluído pela Lei nº 8.950, de 1994)"
1341,1,10,2,0,7,514,0,0,0,0,"Art.520.A apelaçãoserá recebida em seu efeito devolutivo e suspensivo. Será, no entanto, recebida só noefeito devolutivo, quando interposta de sentença que: (Redação dada pela Lei nº 5.925, de 1973)"
1342,1,10,2,0,7,514,0,0,1,0,"I-homologar a divisão ou a demarcação; (Redaçãodada pela Lei nº 5.925, de 1973)"
1343,1,10,2,0,7,514,0,0,2,0,"II-condenar à prestação de alimentos; (Redação dada pela Lei nº 5.925, de 1973)"
1344,1,10,2,0,7,514,0,0,3,0,"III-(Revogado pela Lei nº11.232, de 2005)"
1345,1,10,2,0,7,514,0,0,4,0,"IV-decidir o processo cautelar; (Redaçãodada pela Lei nº 5.925, de 1973)"
1346,1,10,2,0,7,514,0,0,5,0,"V-rejeitar liminarmenteembargos à execução ou julgá-los improcedentes; (Redação dada pela Lei nº 8.950, de 1994)"
1347,1,10,2,0,7,514,0,0,6,0,"VI-julgar procedente opedido de instituição de arbitragem.(Incluído pela Lei nº 9.307, de1996)"
1348,1,10,2,0,7,515,0,0,0,0,"Art.521.Recebida a apelação em ambos os efeitos, o juiz não poderáinovar no processo; recebida só no efeito devolutivo, o apelado poderá promover, desdelogo, a execução provisória da sentença, extraindo a respectiva carta."
