'id','livro','titulo','capitulo','secao','subsecao','artigo','sub_artigo','paragrafo','inciso','alinea','texto'
308,1,4,4,0,0,135,0,0,4,0,"IV-receber dádivas antes ou depois de iniciado o processo; aconselhar algumadas partes acerca do objeto da causa, ou subministrar meios para atender às despesas dolitígio;"
309,1,4,4,0,0,135,0,0,5,0,V-interessado no julgamento da causa em favor de uma das partes.
310,1,4,4,0,0,135,0,1,0,0,Parágrafo único.Poderá ainda o juiz declarar-se suspeito por motivoíntimo.
311,1,4,4,0,0,136,0,0,0,0,"Art.136.Quando dois ou mais juízes forem parentes, consangüíneos ouafins, em linha reta e no segundo grau na linha colateral, o primeiro, que conhecer dacausa no tribunal, impede que o outro participe do julgamento; caso em que o segundo seescusará, remetendo o processo ao seu substituto legal."
312,1,4,4,0,0,137,0,0,0,0,"Art.137.Aplicam-se os motivos de impedimento e suspeição aos juízesde todos os tribunais. O juiz que violar o dever de abstenção, ou não se declararsuspeito, poderá ser recusado por qualquer das partes (art. 304)."
313,1,4,4,0,0,138,0,0,0,0,Art.138.Aplicam-se também os motivos de impedimento e de suspeição:
314,1,4,4,0,0,138,0,0,1,0,"I-ao órgão do Ministério Público, quando não for parte, e, sendo parte,nos casos previstos nos ns. I a IV do art. 135;"
315,1,4,4,0,0,138,0,0,2,0,II-ao serventuário de justiça;
316,1,4,4,0,0,138,0,0,3,0,"III-ao perito; (Redaçãodada pela Lei nº 8.455, de 1992)"
317,1,4,4,0,0,138,0,0,4,0,IV-ao intérprete.
318,1,4,4,0,0,138,0,1,0,0,"§1oA parte interessada deverá argüir o impedimentoou a suspeição, em petição fundamentada e devidamente instruída, na primeiraoportunidade em que Ihe couber falar nos autos; o juiz mandará processar o incidente emseparado e sem suspensão da causa, ouvindo o argüido no prazo de 5 (cinco) dias,facultando a prova quando necessária e julgando o pedido."
319,1,4,4,0,0,138,0,2,0,0,§2oNos tribunais caberá ao relator processar ejulgar o incidente.
320,1,4,5,0,0,139,0,0,0,0,"Art.139.São auxiliares do juízo, além de outros, cujas atribuiçõessão determinadas pelas normas de organização judiciária, o escrivão, o oficial dejustiça, o perito, o depositário, o administrador e o intérprete."
321,1,4,5,0,0,140,0,0,0,0,"Art.140.Em cada juízo haverá um ou mais oficiais de justiça, cujasatribuições são determinadas pelas normas de organização judiciária."
322,1,4,5,0,0,141,0,0,0,0,Art.141.Incumbe ao escrivão:
323,1,4,5,0,0,141,0,0,1,0,"I-redigir, em forma legal, os ofícios, mandados, cartas precatórias e maisatos que pertencem ao seu ofício;"
324,1,4,5,0,0,141,0,0,2,0,"II-executar as ordens judiciais, promovendo citações e intimações, bemcomo praticando todos os demais atos, que Ihe forem atribuídos pelas normas deorganização judiciária;"
325,1,4,5,0,0,141,0,0,3,0,"III-comparecer às audiências, ou, não podendo fazê-lo, designar parasubstituí-lo escrevente juramentado, de preferência datilógrafo ou taquígrafo;"
326,1,4,5,0,0,141,0,0,4,0,"IV-ter, sob sua guarda e responsabilidade, os autos, não permitindo que saiamde cartório, exceto:"
327,1,4,5,0,0,141,0,0,4,1, a)quando tenham de subir à conclusão do juiz;
328,1,4,5,0,0,141,0,0,4,2," b)com vista aos procuradores, ao Ministério Público ou à Fazenda Pública;"
329,1,4,5,0,0,141,0,0,4,3, c)quando devam ser remetidos ao contador ou ao partidor;
330,1,4,5,0,0,141,0,0,4,4," d)quando, modificando-se a competência, forem transferidos a outro juízo;"
331,1,4,5,0,0,141,0,0,5,0,"V-dar, independentemente de despacho, certidão de qualquer ato ou termo doprocesso, observado o disposto no art. 155."
332,1,4,5,0,0,142,0,0,0,0,"Art.142.No impedimento do escrivão, o juiz convocar-lhe-á osubstituto, e, não o havendo, nomeará pessoa idônea para o ato."
333,1,4,5,0,0,143,0,0,0,0,Art.143.Incumbe ao oficial de justiça:
334,1,4,5,0,0,143,0,0,1,0,"I-fazer pessoalmente as citações, prisões, penhoras, arrestos e maisdiligências próprias do seu ofício, certificando no mandado o ocorrido, com menção delugar, dia e hora. A diligência, sempre que possível, realizar-se-á na presença deduas testemunhas;"
335,1,4,5,0,0,143,0,0,2,0,II-executar as ordens do juiz a que estiver subordinado;
336,1,4,5,0,0,143,0,0,3,0,"III-entregar, em cartório, o mandado, logo depois de cumprido;"
337,1,4,5,0,0,143,0,0,4,0,IV-estar presente às audiências e coadjuvar o juiz na manutenção da ordem.
338,1,4,5,0,0,143,0,0,5,0,"V - efetuaravaliações. (Incluído pela Lei nº11.382, de 2006)."
339,1,4,5,0,0,144,0,0,0,0,Art.144.O escrivão e o oficial de justiça são civilmenteresponsáveis:
340,1,4,5,0,0,144,0,0,1,0,"I-quando, sem justo motivo, se recusarem a cumprir, dentro do prazo, os atosque Ihes impõe a lei, ou os que o juiz, a que estão subordinados, Ihes comete;"
341,1,4,5,0,0,144,0,0,2,0,II-quando praticarem ato nulo com dolo ou culpa.
342,1,4,5,0,0,145,0,0,0,0,"Art.145.Quando a prova do fato depender de conhecimento técnico oucientífico, o juiz será assistido por perito, segundo o disposto no art. 421."
343,1,4,5,0,0,145,0,1,0,0,">§1oOsperitos serão escolhidos entre profissionais de nível universitário, devidamenteinscritos no órgão de classe competente, respeitado o disposto no Capítulo Vl, seçãoVll, deste Código. (Incluído pela Lei nº 7.270,de 1984)"
344,1,4,5,0,0,145,0,2,0,0,"§2oOs peritos comprovarão sua especialidade na matériasobre que deverão opinar, mediante certidão do órgão profissional em que estivereminscritos. (Incluído pela Lei nº 7.270, de 1984)"
345,1,4,5,0,0,145,0,3,0,0,"§3oNas localidades onde não houver profissionaisqualificados que preencham os requisitos dos parágrafos anteriores, a indicação dosperitos será de livre escolha do juiz. (Incluídopela Lei nº 7.270, de 1984)"
346,1,4,5,0,0,146,0,0,0,0,"Art.146.O perito tem o dever de cumprir o ofício, no prazo que Iheassina a lei, empregando toda a sua diligência; pode, todavia, escusar-se do encargoalegando motivo legítimo."
347,1,4,5,0,0,146,0,1,0,0,"Parágrafo único.A escusaserá apresentada dentro de 5 (cinco) dias, contados da intimação ou do impedimentosuperveniente, sob pena de se reputar renunciado o direito a alegá-la (art. 423). (Redação dada pela Lei nº 8.455, de 1992)"
348,1,4,5,0,0,147,0,0,0,0,"Art.147.O perito que, por dolo ou culpa, prestar informaçõesinverídicas, responderá pelos prejuízos que causar à parte, ficará inabilitado, por 2(dois) anos, a funcionar em outras perícias e incorrerá na sanção que a lei penalestabelecer."
349,1,4,5,0,0,148,0,0,0,0,"Art.148.A guarda e conservação de bens penhorados, arrestados,seqüestrados ou arrecadados serão confiadas a depositário ou a administrador, nãodispondo a lei de outro modo."
350,1,4,5,0,0,149,0,0,0,0,"Art.149.O depositário ou administrador perceberá, por seu trabalho,remuneração que o juiz fixará, atendendo à situação dos bens, ao tempo do serviço eàs dificuldades de sua execução."
351,1,4,5,0,0,149,0,1,0,0,"Parágrafo único.O juiz poderá nomear, por indicação do depositário ou doadministrador, um ou mais prepostos."
352,1,4,5,0,0,150,0,0,0,0,"Art.150.O depositário ou o administrador responde pelos prejuízos que,por dolo ou culpa, causar à parte, perdendo a remuneração que lhe foi arbitrada; mastem o direito a haver o que legitimamente despendeu no exercício do encargo."
353,1,4,5,0,0,151,0,0,0,0,Art.151.O juiz nomeará intérprete toda vez que o repute necessáriopara:
354,1,4,5,0,0,151,0,0,1,0,"I-analisar documento de entendimento duvidoso, redigido em línguaestrangeira;"
355,1,4,5,0,0,151,0,0,2,0,II-verter em português as declarações das partes e das testemunhas que nãoconhecerem o idioma nacional;
356,1,4,5,0,0,151,0,0,3,0,"III-traduzir a linguagem mímica dos surdos-mudos, que não puderem transmitira sua vontade por escrito."
357,1,4,5,0,0,152,0,0,0,0,Art.152.Não pode ser intérprete quem:
358,1,4,5,0,0,152,0,0,1,0,I-não tiver a livre administração dos seus bens;
359,1,4,5,0,0,152,0,0,2,0,II-for arrolado como testemunha ou serve como perito no processo;
360,1,4,5,0,0,152,0,0,3,0,"III-estiver inabilitado ao exercício da profissão por sentença penalcondenatória, enquanto durar o seu efeito."
361,1,4,5,0,0,153,0,0,0,0,"Art.153.O intérprete, oficial ou não, é obrigado a prestar o seuofício, aplicando-se-lhe o disposto nos arts. 146 e 147."
362,1,5,1,0,0,154,0,0,0,0,"Art.154.Os atos e termos processuais não dependem de forma determinadasenão quando a lei expressamente a exigir, reputando-se válidos os que, realizados deoutro modo, Ihe preencham a finalidade essencial."
363,1,5,1,0,0,154,0,1,0,0,"§ 2o Todos os atos e termos do processo podem ser produzidos, transmitidos, armazenados e assinados por meio eletrônico, na forma da lei. (Incluído pela Lei nº 11.419, de 2006)."
364,1,5,1,0,0,155,0,0,0,0,"Art.155.Os atos processuais são públicos. Correm, todavia, em segredode justiça os processos:"
365,1,5,1,0,0,155,0,0,1,0,I-em que o exigir o interesse público;
366,1,5,1,0,0,155,0,0,2,0,"Il-que dizem respeito acasamento, filiação, separação dos cônjuges, conversão desta em divórcio, alimentose guarda de menores. (Redação dada pela Lei nº 6.515, de 1977)"
367,1,5,1,0,0,155,0,1,0,0,"Parágrafo único.O direito de consultar os autos e de pedir certidões deseus atos é restrito às partes e a seus procuradores. O terceiro, que demonstrarinteresse jurídico, pode requerer ao juiz certidão do dispositivo da sentença, bem comode inventário e partilha resultante do desquite."
368,1,5,1,0,0,156,0,0,0,0,Art.156.Em todos os atos e termos do processo é obrigatório o uso dovernáculo.
369,1,5,1,0,0,157,0,0,0,0,"Art.157.Só poderá ser junto aos autos documento redigido em línguaestrangeira, quando acompanhado de versão em vernáculo, firmada por tradutorjuramentado."
370,1,5,1,0,0,158,0,0,0,0,"Art.158.Os atos das partes, consistentes em declaraçõesunilaterais ou bilaterais de vontade, produzem imediatamente a constituição, amodificação ou a extinção de direitos processuais."
371,1,5,1,0,0,158,0,1,0,0,Parágrafo único.A desistência da ação só produzirá efeito depois dehomologada por sentença.
372,1,5,1,0,0,159,0,0,0,0,"Art.159.Salvono Distrito Federal e nas Capitais dos Estados, todas as petições e documentos queinstruírem o processo, não constantes de registro público, serão sempre acompanhadosde cópia, datada e assinada por quem os oferecer."
373,1,5,1,0,0,159,0,1,0,0,"§1oDepois de conferir a cópia, o escrivão ou chefeda secretaria irá formando autos suplementares, dos quais constará a reprodução detodos os atos e termos do processo original."
374,1,5,1,0,0,159,0,2,0,0,"§2oOs autos suplementares só sairão de cartóriopara conclusão ao juiz, na falta dos autos originais."
375,1,5,1,0,0,160,0,0,0,0,"Art.160.Poderão as partes exigir recibo de petições, arrazoados,papéis e documentos que entregarem em cartório."
376,1,5,1,0,0,161,0,0,0,0,"Art.161.É defeso lançar, nos autos, cotas marginais ou interlineares;o juiz mandará riscá-las, impondo a quem as escrever multa correspondente à metade dosalário mínimo vigente na sede do juízo."
377,1,5,1,0,0,162,0,0,0,0,"Art.162.Os atos do juiz consistirão em sentenças, decisõesinterlocutórias e despachos."
378,1,5,1,0,0,162,0,1,0,0,">§ 1o Sentença é o ato do juiz que implicaalguma das situações previstas nos arts. 267 e 269 desta Lei. (Redação dada pela Lei nº 11.232, de2005)"
379,1,5,1,0,0,162,0,2,0,0,"§2oDecisão interlocutória é o ato pelo qual ojuiz, no curso do processo, resolve questão incidente."
380,1,5,1,0,0,162,0,3,0,0,"§3oSão despachos todos os demais atos do juizpraticados no processo, de ofício ou a requerimento da parte, a cujo respeito a lei nãoestabelece outra forma."
381,1,5,1,0,0,162,0,4,0,0,">§4oOsatos meramente ordinatórios, como a juntada e a vista obrigatória, independem dedespacho, devendo ser praticados de ofício pelo servidor e revistos pelo juiz quandonecessários. (Incluído pela Lei nº 8.952, de1994)"
382,1,5,1,0,0,163,0,0,0,0,Art.163.Recebe a denominação de acórdão o julgamento proferido pelostribunais.
383,1,5,1,0,0,164,0,0,0,0,"Art.164.Os despachos, decisões, sentenças e acórdãos serãoredigidos, datados e assinados pelos juízes. Quando forem proferidos, verbalmente, otaquígrafo ou o datilógrafo os registrará, submetendo-os aos juízes para revisão eassinatura."
384,1,5,1,0,0,164,0,1,0,0,"Parágrafo único. A assinatura dos juízes, em todos os graus de jurisdição, pode ser feita eletronicamente, na forma da lei.(Incluído pela Lei nº 11.419, de 2006)."
385,1,5,1,0,0,165,0,0,0,0,"Art.165.As sentenças e acórdãos serão proferidos com observância dodisposto no art. 458; as demais decisões serão fundamentadas, ainda que de modo conciso."
386,1,5,1,0,0,166,0,0,0,0,"Art.166.Ao receber a petição inicial de qualquer processo, o escrivãoa autuará, mencionando o juízo, a natureza do feito, o número de seu registro, os nomesdas partes e a data do seu início; e procederá do mesmo modo quanto aos volumes que seforem formando."
387,1,5,1,0,0,167,0,0,0,0,"Art.167.O escrivão numerará e rubricará todas as folhas dos autos,procedendo da mesma forma quanto aos suplementares."
388,1,5,1,0,0,167,0,1,0,0,"Parágrafo único.Às partes, aos advogados, aos órgãos do MinistérioPúblico, aos peritos e às testemunhas é facultado rubricar as folhas correspondentesaos atos em que intervieram."
389,1,5,1,0,0,168,0,0,0,0,"Art.168.Os termos de juntada, vista, conclusão e outros semelhantesconstarão de notas datadas e rubricadas pelo escrivão."
390,1,5,1,0,0,169,0,0,0,0,"Art.169.Os atos e termos do processo serão datilografados ou escritoscom tinta escura e indelével, assinando-os as pessoas que neles intervieram. Quando estasnão puderem ou não quiserem firmá-los, o escrivão certificará, nos autos, aocorrência."
391,1,5,1,0,0,169,0,1,0,0,">§ 1o É vedado usar     abreviaturas. (Incluído pela Lei nº 11.419, de 2006)."
392,1,5,1,0,0,169,0,2,0,0," § 2o Quando se tratar de     processo total ou parcialmente eletrônico, os atos processuais praticados na     presença do juiz poderão ser produzidos e armazenados de modo integralmente     digital em arquivo eletrônico inviolável, na forma da lei, mediante registro     em termo que será assinado digitalmente pelo juiz e pelo escrivão ou chefe     de secretaria, bem como pelos advogados das partes.(Incluído pela Lei nº 11.419, de 2006)."
393,1,5,1,0,0,169,0,3,0,0," § 3o No caso do § 2o     deste artigo, eventuais contradições na transcrição deverão ser suscitadas oralmente no momento da realização do ato, sob pena de preclusão, devendo o juiz decidir de plano, registrando-se a alegação e a decisão no termo.(Incluído pela Lei nº 11.419, de 2006)."
394,1,5,1,0,0,169,0,4,0,0,Parágrafo único.É vedado usar abreviaturas.
395,1,5,1,0,0,170,0,0,0,0,"Art. 170. É lícito o uso dataquigrafia, da estenotipia, ou de outro método idôneo, em qualquer juízo ou tribunal.(Redação dada pela Lei nº 8.952, de 1994)"
396,1,5,1,0,0,171,0,0,0,0,"Art.171.Não se admitem, nos atos e termos, espaços em branco, bem comoentrelinhas, emendas ou rasuras, salvo se aqueles forem inutilizados e estas expressamenteressalvadas."
397,1,5,2,0,0,172,0,0,0,0,"Art. 172. Os atos processuaisrealizar-se-ão em dias úteis, das 6 (seis) às 20 (vinte) horas. (Redação dada pela Lei nº 8.952, de 1994)"
398,1,5,2,0,0,172,0,1,0,0,"§1oSerão, todavia, concluídos depois das 20 (vinte) horasos atos iniciados antes, quando o adiamento prejudicar a diligência ou causar grave dano.(Redação dada pela Lei nº 8.952, de 1994)"
399,1,5,2,0,0,172,0,2,0,0,"§2oA citação e a penhora poderão, em casos excepcionais,e mediante autorização expressa do juiz, realizar-se em domingos e feriados, ou nos diasúteis, fora do horário estabelecido neste artigo, observado o disposto no art. 5o,inciso Xl, da Constituição Federal. (Redação dada pela Leinº 8.952, de 1994)"
400,1,5,2,0,0,172,0,3,0,0,"§3oQuando o ato tiver que ser praticado em determinadoprazo, por meio de petição, esta deverá ser apresentada no protocolo, dentro dohorário de expediente, nos termos da lei de organização judiciária local. (Incluído pela Lei nº 8.952, de 1994)"
401,1,5,2,0,0,173,0,0,0,0,Art.173.Durante as férias e nos feriados não se praticarão atosprocessuais. Excetuam-se:
402,1,5,2,0,0,173,0,0,1,0,I-a produção antecipada de provas (art. 846);
403,1,5,2,0,0,173,0,0,2,0,"II-a citação, a fim de evitar o perecimento de direito; e bem assim oarresto, o seqüestro, a penhora, a arrecadação, a busca e apreensão, o depósito, aprisão, a separação de corpos, a abertura de testamento, os embargos de terceiro, anunciação de obra nova e outros atos análogos."
404,1,5,2,0,0,173,0,1,0,0,Parágrafo único.O prazo para a resposta do réu só começará a correr noprimeiro dia útil seguinte ao feriado ou às férias.
405,1,5,2,0,0,174,0,0,0,0,Art.174.Processam-se durante as férias e não se suspendem pelasuperveniência delas:
406,1,5,2,0,0,174,0,0,1,0,"I-os atos de jurisdição voluntária bem como os necessários àconservação de direitos, quando possam ser prejudicados pelo adiamento;"
407,1,5,2,0,0,174,0,0,2,0,"II-as causas de alimentos provisionais, de dação ou remoção de tutores ecuradores, bem como as mencionadas no art. 275;"
408,1,5,2,0,0,174,0,0,3,0,III-todas as causas que a lei federal determinar.
409,1,5,2,0,0,175,0,0,0,0,"Art.175.São feriados, para efeito forense, os domingos e os diasdeclarados por lei."
410,1,5,2,0,0,176,0,0,0,0,"Art.176.Os atos processuais realizam-se de ordinário na sede do juízo.Podem, todavia, efetuar-se em outro lugar, em razão de deferência, de interesse dajustiça, ou de obstáculo argüido pelo interessado e acolhido pelo juiz."
411,1,5,3,0,0,177,0,0,0,0,"Art.177.Os atos processuais realizar-se-ão nos prazos prescritos emlei. Quando esta for omissa, o juiz determinará os prazos, tendo em conta a complexidadeda causa."
412,1,5,3,0,0,178,0,0,0,0,"Art.178.O prazo, estabelecido pela lei ou pelo juiz, é contínuo, nãose interrompendo nos feriados."
413,1,5,3,0,0,179,0,0,0,0,Art.179.A superveniência de férias suspenderá o curso do prazo; o queIhe sobejar recomeçará a correr do primeiro dia útil seguinte ao termo das férias.
414,1,5,3,0,0,180,0,0,0,0,"Art.180.Suspende-se também o curso do prazo por obstáculo criado pelaparte ou ocorrendo qualquer das hipóteses do art. 265, I e III; casos em que o prazoserá restituído por tempo igual ao que faltava para a sua complementação."
415,1,5,3,0,0,181,0,0,0,0,"Art.181.Podem as partes, de comum acordo, reduzir ou prorrogar o prazodilatório; a convenção, porém, só tem eficácia se, requerida antes do vencimento doprazo, se fundar em motivo legítimo."
416,1,5,3,0,0,181,0,1,0,0,§1oO juiz fixará o dia do vencimento do prazo daprorrogação.
417,1,5,3,0,0,181,0,2,0,0,§2oAs custas acrescidas ficarão a cargo da parte emfavor de quem foi concedida a prorrogação.
418,1,5,3,0,0,182,0,0,0,0,"Art.182.É defeso às partes, ainda que todas estejam de acordo, reduzirou prorrogar os prazos peremptórios. O juiz poderá, nas comarcas onde for difícil otransporte, prorrogar quaisquer prazos, mas nunca por mais de 60 (sessenta) dias."
419,1,5,3,0,0,182,0,1,0,0,"Parágrafo único.Em caso de calamidade pública, poderá ser excedido olimite previsto neste artigo para a prorrogação de prazos."
420,1,5,3,0,0,183,0,0,0,0,"Art.183.Decorrido o prazo, extingue-se, independentemente dedeclaração judicial, o direito de praticar o ato, ficando salvo, porém, à parte provarque o não realizou por justa causa."
421,1,5,3,0,0,183,0,1,0,0,"§1oReputa-se justa causa o evento imprevisto, alheioà vontade da parte, e que a impediu de praticar o ato por si ou por mandatário."
422,1,5,3,0,0,183,0,2,0,0,§2oVerificada a justa causa o juiz permitirá àparte a prática do ato no prazo que Ihe assinar.
423,1,5,3,0,0,184,0,0,0,0,"Art.184.Salvo disposição em contrário, computar-se-ão os prazos,excluindo o dia do começo e incluindo o do vencimento. (Redação dada pela Lei nº 5.925, de 1973)"
424,1,5,3,0,0,184,0,1,0,0,"§1oConsidera-se prorrogado o prazo até o primeirodia útil se o vencimento cair em feriado ou em dia em que: (Redação dada pela Lei nº 5.925, de 1973)"
425,1,5,3,0,0,184,0,1,1,0,I-for determinado o fechamento do fórum;
426,1,5,3,0,0,184,0,1,2,0,II-o expediente forense for encerrado antes da hora normal.
427,1,5,3,0,0,184,0,2,0,0,">§2oOs prazossomente começam a correr do primeiro dia útil após a intimação (art. 240 e parágrafoúnico). (Redação dada pela Lei nº8.079, de 1990)"
428,1,5,3,0,0,185,0,0,0,0,"Art.185.Não havendo preceito legal nem assinação pelo juiz, será de5 (cinco) dias o prazo para a prática de ato processual a cargo da parte."
429,1,5,3,0,0,186,0,0,0,0,Art.186.A parte poderá renunciar ao prazo estabelecido exclusivamenteem seu favor.
430,1,5,3,0,0,187,0,0,0,0,"Art.187.Em qualquer grau de jurisdição, havendo motivo justificado,pode o juiz exceder, por igual tempo, os prazos que este Código Ihe assina."
431,1,5,3,0,0,188,0,0,0,0,Art.188.Computar-se-á em quádruplo o prazo para contestar e em dobropara recorrer quando a parte for a Fazenda Pública ou o Ministério Público.
432,1,5,3,0,0,189,0,0,0,0,Art.189.O juiz proferirá:
433,1,5,3,0,0,189,0,0,1,0,"I-os despachos de expediente, no prazo de 2 (dois) dias;"
434,1,5,3,0,0,189,0,0,2,0,"II-as decisões, no prazo de 10 (dez) dias."
435,1,5,3,0,0,190,0,0,0,0,"Art.190.Incumbirá ao serventuário remeter os autos conclusos no prazode 24 (vinte e quatro) horas e executar os atos processuais no prazo de 48 (quarenta eoito) horas, contados:"
436,1,5,3,0,0,190,0,0,1,0,"I-da data em que houver concluído o ato processual anterior, se Ihe foiimposto pela lei;"
437,1,5,3,0,0,190,0,0,2,0,"II-da data em que tiver ciência da ordem, quando determinada pelo juiz."
438,1,5,3,0,0,190,0,1,0,0,"Parágrafo único.Ao receber os autos, certificará o serventuário o dia e ahora em que ficou ciente da ordem, referida no no Il."
439,1,5,3,0,0,191,0,0,0,0,"Art.191.Quando os litisconsortes tiverem diferentes procuradores,ser-lhes-ão contados em dobro os prazos para contestar, para recorrer e, de modo geral,para falar nos autos."
440,1,5,3,0,0,192,0,0,0,0,"Art.192.Quando a lei não marcar outro prazo, as intimações somenteobrigarão a comparecimento depois de decorridas 24 (vinte e quatro) horas."
441,1,5,3,0,0,193,0,0,0,0,"Art.193.Compete ao juiz verificar se o serventuário excedeu, sem motivolegítimo, os prazos que este Código estabelece."
442,1,5,3,0,0,194,0,0,0,0,"Art.194.Apurada a falta, o juiz mandará instaurar procedimentoadministrativo, na forma da Lei de Organização Judiciária."
443,1,5,3,0,0,195,0,0,0,0,"Art.195.O advogado deve restituir os autos no prazo legal. Não ofazendo, mandará o juiz, de ofício, riscar o que neles houver escrito e desentranhar asalegações e documentos que apresentar."
444,1,5,3,0,0,196,0,0,0,0,"Art.196.É lícito a qualquer interessado cobrar os autos ao advogadoque exceder o prazo legal. Se, intimado, não os devolver dentro em 24 (vinte e quatro)horas, perderá o direito à vista fora de cartório e incorrerá em multa, correspondenteà metade do salário mínimo vigente na sede do juízo."
445,1,5,3,0,0,196,0,1,0,0,"Parágrafo único.Apurada a falta, o juiz comunicará o fato à seção localda Ordem dos Advogados do Brasil, para o procedimento disciplinar e imposição da multa."
446,1,5,3,0,0,197,0,0,0,0,Art.197.Aplicam-se ao órgão do Ministério Público e ao representanteda Fazenda Pública as disposições constantes dos arts. 195 e 196.
447,1,5,3,0,0,198,0,0,0,0,"Art.198.Qualquer das partes ou o órgão do Ministério Público poderárepresentar ao presidente do Tribunal de Justiça contra o juiz que excedeu os prazosprevistos em lei. Distribuída a representação ao órgão competente, instaurar-se-áprocedimento para apuração da responsabilidade. O relator, conforme as circunstâncias,poderá avocar os autos em que ocorreu excesso de prazo, designando outro juiz paradecidir a causa."
448,1,5,3,0,0,199,0,0,0,0,Art.199.A disposição do artigo anterior aplicar-se-á aos tribunaissuperiores na forma que dispuser o seu regimento interno.
449,1,5,4,0,0,200,0,0,0,0,"Art.200.Os atos processuais serão cumpridos por ordem judicial ourequisitados por carta, conforme hajam de realizar-se dentro ou fora dos limitesterritoriais da comarca."
450,1,5,4,0,0,201,0,0,0,0,"Art.201.Expedir-se-á carta de ordem se o juiz for subordinado aotribunal de que ela emanar; carta rogatória, quando dirigida à autoridade judiciáriaestrangeira; e carta precatória nos demais casos."
451,1,5,4,0,0,202,0,0,0,0,"Art.202.São requisitos essenciais da carta de ordem, da cartaprecatória e da carta rogatória:"
452,1,5,4,0,0,202,0,0,1,0,I-a indicação dos juízes de origem e de cumprimento do ato;
453,1,5,4,0,0,202,0,0,2,0,"II-o inteiro teor da petição, do despacho judicial e do instrumento domandato conferido ao advogado;"
454,1,5,4,0,0,202,0,0,3,0,"III-a menção do ato processual, que Ihe constitui o objeto;"
455,1,5,4,0,0,202,0,0,4,0,IV-o encerramento com a assinatura do juiz.
456,1,5,4,0,0,202,0,1,0,0,"§1oO juiz mandará trasladar, na carta, quaisqueroutras peças, bem como instruí-la com mapa, desenho ou gráfico, sempre que estesdocumentos devam ser examinados, na diligência, pelas partes, peritos ou testemunhas."
457,1,5,4,0,0,202,0,2,0,0,"§2oQuando o objeto da carta for exame pericial sobredocumento, este será remetido em original, ficando nos autos reprodução fotográfica."
